{
  "$schema": "../../schemas/governance-decisions.schema.json",
  "decisionSetId": "M2-BATCH-01R",
  "decidedBy": "PROJECT_OWNER / KNOWLEDGE_GOVERNANCE_AUTHORITY",
  "decidedByIdentity": "ROLE_ONLY · no personal identity recorded or fabricated; the file-based governance mechanism exposes no authenticated project actor identity",
  "decidedAt": "2026-09-23",
  "authorizationSource": "M2-BATCH-01R · explicit human project-governance instruction (GOVERNED SUPERSESSION RESOLUTION + CANONICAL ACCEPTANCE)",
  "statement": "Decisiones humanas de gobierno sobre la fuente registrada. No son aceptación canónica, no aprueban el candidato y no publican; el extractor las aplica solo si se verifican literalmente contra la fuente.",
  "capabilityId": "OP-05",
  "approvedCounts": [
    {
      "label": "CE",
      "declared": 4,
      "sourceLiteral": "| CE | 4 |"
    },
    {
      "label": "VA",
      "declared": 10,
      "sourceLiteral": "| VA | 10 |"
    },
    {
      "label": "Reglas primarias",
      "declared": 11,
      "sourceLiteral": "| Reglas primarias | 11 |"
    },
    {
      "label": "Familias de hallazgo",
      "declared": 8,
      "sourceLiteral": "| Familias de hallazgo | 8 |"
    },
    {
      "label": "Patrones de intervención",
      "declared": 8,
      "sourceLiteral": "| Patrones de intervención | 8 |"
    },
    {
      "label": "Familias de instrumentos",
      "declared": 8,
      "sourceLiteral": "| Familias de instrumentos | 8 |"
    },
    {
      "label": "Familias de entregables",
      "declared": 8,
      "sourceLiteral": "| Familias de entregables | 8 |"
    },
    {
      "label": "CRV principales",
      "declared": 8,
      "sourceLiteral": "| CRV principales | 8 |"
    }
  ],
  "governedBacklog": [],
  "historicalClosure": {
    "marker": "OP05-K4-v1.0 · K4-VALIDATED · CLOSED",
    "precedingLiterals": [
      "DoD: 27/27 PASS",
      "A–V: 22/22 PASS",
      "K1–K4: 4/4 PASS"
    ],
    "precedingWindowLines": 6,
    "otherOccurrences": "CONFIRMATION_OR_NON_FINAL",
    "rejectedStates": [
      "| K4 Conocimiento | 🟡 DOCUMENTARY VALIDATION REQUIRED |"
    ]
  },
  "checksum": "sha256:2a8c30eb2ce3c548fb9ad507e93474beb6940b525e1a1b8a853532ebbcb41462"
}
